{
  "proverVersion": "4.0.0-riscv",
  "proof": "0xdeadbeef",
  "startBlockNumber": 1000501,
  "endBlockNumber": 1000520,
  "publicInputs": {
    "endBlockNumber": 1000520,
    "endBlockTimestamp": 1763000457,
    "l2L1BridgeTransactionTree": "0x1111111111111111111111111111111111111111111111111111111111111111",
    "parentL1L2BridgeRollingHash": "0x2222222222222222222222222222222222222222222222222222222222222222",
    "parentL1L2BridgeRollingHashMessageNumber": 0,
    "endL1L2BridgeRollingHash": "0x3333333333333333333333333333333333333333333333333333333333333333",
    "endL1L2BridgeRollingHashMessageNumber": 7,
    "dynamicChainConfigHash": "0xc0c0c0c0c0c0c0c0c0c0c0c0c0c0c0c0c0c0c0c0c0c0c0c0c0c0c0c0c0c0c0c0",
    "parentFtxRollingHash": "0x4444444444444444444444444444444444444444444444444444444444444444",
    "endFtxRollingHash": "0x5555555555555555555555555555555555555555555555555555555555555555",
    "lastProcessedFtxNumber": 9,
    "filteredAddressesHash": "0x6666666666666666666666666666666666666666666666666666666666666666",
    "parentShnarf": "0x4747474747474747474747474747474747474747474747474747474747474747",
    "endShnarf": "0x8d8d8d8d8d8d8d8d8d8d8d8d8d8d8d8d8d8d8d8d8d8d8d8d8d8d8d8d8d8d8d8d"
  }
}
